[
  {
    "id": "cd28da0f-a3e4-465c-82f1-acade4e8e170",
    "instance_id": "cd28da0f-a3e4-465c-82f1-acade4e8e170",
    "title": "Nod",
    "barcode": "456743454532"
  },
  {
    "id": "cd28da0f-a3e4-465c-82f1-acade4e8e170",
    "instance_id": "cd28da0f-a3e4-465c-82f1-acade4e8e170",
    "title": "Uprooted",
    "barcode": "645398607547"
  }
]
